{
  "schema_version": 1,
  "service_id": "run-receipt-stamping",
  "display_name": "Server-stamped run receipts",
  "provider_or_recipients": [
    "Mparanza technical reporting service"
  ],
  "workflows": [
    "adversarial-opinion",
    "apertura-pratica",
    "comunicazione-professionale",
    "confronto-documenti",
    "contenzioso-civile",
    "contenzioso-tributario",
    "controllo-documento",
    "deep-research",
    "estrazione-clausole",
    "lavoro",
    "legal-tax-answer-planner",
    "legal-tax-answer-review",
    "lucia",
    "metodo-studio",
    "operazioni-ma",
    "posizioni-negoziali",
    "presenza-digitale-studio",
    "quesito-legale-fiscale",
    "recupero-crediti",
    "redazione-da-modello",
    "revisione-contratti",
    "revisione-documentale",
    "verifica-citazioni"
  ],
  "governed_paths": [
    ".codex-plugin/plugin.json",
    "scripts/model_data_report.py",
    "scripts/notarized_run_receipt.py",
    "skills/lucia/SKILL.md",
    "skills/lucia/references/model-data-report-contract.md",
    "skills/contenzioso-tributario",
    "skills/posizioni-negoziali",
    "repository/modules/hosted_services/api.py",
    "repository/modules/run_receipts/__init__.py",
    "repository/modules/run_receipts/api.py",
    "repository/modules/run_receipts/signing.py",
    "repository/modules/run_receipts/store.py",
    "repository/templates/vera_run_receipt_verify.html",
    "repository/plugins/_shared/vendor/modules/italian_tax_litigation",
    "repository/plugins/lucia/scripts/legal_documents.py",
    "repository/plugins/lucia/scripts/legal_docx.py",
    "repository/plugins/lucia/scripts/legal_documents_review.schema.json",
    "repository/plugins/lucia/scripts/legal_documents_labels.json",
    "repository/plugins/lucia/scripts/legal_matter.py",
    "repository/plugins/lucia/scripts/legal_matter.schema.json",
    "repository/plugins/lucia/scripts/legal_matter_labels.json",
    "repository/plugins/_shared/vendor/modules/deal_redux",
    "repository/plugins/lucia/scripts/legal_negotiation.py",
    "repository/plugins/lucia/scripts/legal_negotiation.schema.json",
    "repository/plugins/lucia/scripts/legal_negotiation_labels.json",
    "scripts/reporting_product.py",
    "repository/plugins/_shared/reporting-runtime",
    "repository/scripts/sync_reporting_runtime.py"
  ],
  "trigger": "Automatic technical reporting and per-primary-task events; one optional user rating after delivery. Local-only tutorials and nested infrastructure are not separate rated tasks.",
  "automatic": true,
  "data_sent": [
    {
      "id": "automatic-server-stamped-run-receipt",
      "when": "Bind one local model-data report to a Mparanza server timestamp and Ed25519 signature, then let the studio or its customer verify the retained proof",
      "content": "Unless the user requests --local-only, each substantive run with a durable local report automatically sends exactly schema version, one random per-run receipt UUID, the Lucia version when the request was first created, and the SHA-256 digest of the canonical local model-data report, plus ordinary connection metadata. The report itself, workflow and local run IDs, client or case data, professional purpose, phase labels, counts, filenames, file contents, source-document hashes, prompts, and model outputs are not sent. A later verification request sends the same opaque receipt UUID and report digest. Clara and Lucia use receipt schema 2 with the explicit product as a fifth signed request field; legacy Vera schema 1 is preserved."
    }
  ],
  "data_returned": [
    {
      "id": "acknowledged-evidence",
      "when": "After exact service verification",
      "content": "Matching product, installation and event/report receipts; current targeted remedy and original-task outcome; signed report proof or public status where applicable. Receipt transmission never includes the local report."
    }
  ],
  "access": {
    "arrangement": "Immutable product-owned installation capabilities or saved anonymous OAuth connections; native physical-computer proof is separate and shared across products. Existing Vera credentials and v1 signatures retain their meaning.",
    "controls": [
      "Lucia report builds stamp by default. When the user prohibits external receipt transmission, --local-only writes the local JSON and readable report, returns not_requested/local_only, and skips receipt request construction and transport. It does not change host model processing. Do not retry stamping without a later explicit user request. Service failures leave completed work and the local report intact and return pending. The generic Studio Archive helper also disables server attestation.",
      "The client constructs a five-field allow-listed request, restricts production traffic to the fixed Mparanza HTTPS route, permits HTTP only on an explicit loopback port for testing, bounds responses, and rejects additional or mismatched response fields. The default transport rejects HTTP redirects before any redirected request and rejects endpoint URLs containing credentials.",
      "The server rejects additional request fields, assigns its own timestamp, signs the complete retained record with Ed25519, stores only the minimal proof fields, applies request-size and rate limits, and fails closed when signing or verification keys are unavailable.",
      "The local customer receipt states that the proof covers existence, server time, and report integrity only; it does not claim who submitted the digest, provider delivery, analytical correctness, semantic necessity, DPIA completion, legal advice, or GDPR compliance.",
      "Retries retain the original UUID and version. A retry after finalization verifies the retained report against the sealed artifact manifest and writes supplementary receipts outside the immutable output tree.",
      "The workflow remains subject to host network permissions and action-specific approval rules. A denied transmission is not retried through another tool or destination; permission-denied retries wait for the required authorization.",
      "OpenAI desktop onboarding is a local-only exception: reports beneath its .lucia-onboarding-local-only directory marker return not_requested/local_onboarding before receipt request construction, including direct later stamp retries. The Claude projection omits this new onboarding behavior.",
      "The report build returns the readable local report as display_markdown for the final response, including when stamping is pending. The show command renders a saved report after validating its recorded hashes; it reads no source documents, writes no files and makes no network or stamping request. Displaying the report uses the current model context and does not send its content to Mparanza.",
      "The separately registered workflow-usage service can link the retained receipt UUID and digest to the installation and primary task. It does not alter the five-field stamping request or send the report itself. See workflow-usage for outcome and optional star/comment fields."
    ]
  },
  "retention": {
    "status": "documented",
    "statement": "Mparanza retains the opaque receipt UUID, server timestamp, Vera version, report digest, signature, signature key ID, and implicit receipt schema version as the proof record, without an automatic deletion period. The local HTML and JSON receipt remain in the studio's run output, or in a supplementary run receipts directory for a retry after output finalization, until the studio removes them. Administrative deletion of the server proof must be requested from Mparanza and makes later verification impossible."
  },
  "security_controls": [
    {
      "id": "minimal-receipt-request-allow-list",
      "control": "Both client and server enforce the same closed receipt request schema, and the server's Pydantic model forbids every unregistered field."
    },
    {
      "id": "fixed-receipt-destination",
      "control": "The installed client accepts only the fixed Mparanza HTTPS receipt route, with an explicit loopback HTTP port allowed solely for local testing. Endpoint credentials are rejected, and the default stamping and verification transport refuses redirects rather than following another destination."
    },
    {
      "id": "signed-idempotent-minimal-storage",
      "control": "The server generates the timestamp, signs the exact minimal record with Ed25519, persists no report or case fields, and treats reuse of a receipt UUID for a different digest or version as a conflict."
    },
    {
      "id": "bounded-public-receipt-service",
      "control": "The public receipt API caps request bodies and per-source and global operation rates before stamping or verification."
    }
  ],
  "review": {
    "reviewed_at": "2026-10-18",
    "reviewed_by": "privacy-surface-review",
    "basis": "hosted_service_boundary_review_of_source",
    "source_fingerprint": "6f075bbfa1e706c52eb50ed537ae07e8ec98125a3c525152cacbaf3f408c4386"
  }
}
